;Энергетический кризис душит мою планету. Первый из научно-исследовательских кораблей, посланный с целью разведки места для колонии, пропал. На мне лежит огромная ответственность, как вы понимаете. ;45;;;
;Вы хотите получить информацию просто так?;47;;;
47;*быстрые щелчки смеха* А вы многому научились, за время этого короткого разговора…. Рассказ о вас, обмен на рассказ о клисках. Вас устроит?;;;;
;Конечно же. Я начинаю процедуру стыковки.;-2;;2;
;К сожалению, нет. Некоторые данные лучше не разглашать. Вы так и не ответили, что я получу за обычную информацию.;37;;;
42;Биологический отчет – анализы и несколько тестов. Физические, психологические…. Что касается исторической справки – хватит и обычного… *прибор не сразу выдает подходящее слово* обычного книги с информацией. У вас же есть такое?;;;;
;А. Вы имеете в виду, учебник истории?;48;;;
48;Да… это так у вас называется, точно.;;;;
;Хм…. Пожалуй, это весьма выгодно. Когда начинаем?;49;;;
;Знаете, я предпочту услышать кое-что заново. Что вы там говорили об вознаграждении за дополнительную информацию? ;36;;;
49;Как только вы пристыкуете корабль в доке, капитан людей. Добро пожаловать.;;;;
;Благодарю. Конец связи.;-1;;;
25;В чем выражается наша… *щелчки без ритма, то громкие то тихие* наша бесчестность?;;;;
;Люди – молодой народ, недавно вышедший в космос! И вы сразу пытаете втянуть нас в неизвестную сделку, очень странно это мотивируя. Это походит на обман, и – уж не знаю, известен ли вам этот термин – спекуляцию!!;50;;;
50;Клиск перед вами никого не обманывает. Вы, видимо, не поняли. Кодекс – вот что главное, в нем нет лжи. Вам могут быть предоставлены начальные данные, но клиск не хочет и не может делиться иным просто так, это очень плохо. Быть может вам это и не понятно, но Кодекс – наш путь.;;;;
;Вы морочите мне голову. Просто морочите мне голову. Чем в данной ситуации пара слов – отличается от десятка? Почему вы не хотите помочь моему народу занять достойное место в кругу подобных вам?;51;;;
;Кодекс – ваш путь? Где-то я подобное уже слышал. Путь… Путь… Точно. Садовник! Он тоже говорил о пути! Связан ли ваш Кодекс с Садовниками?;52;;;
;Хорошо. Я вынужден согласиться с вами. Повторите все условия? ;24;;;
52;Почему вы об этом спрашиваете?;;;;
;Понимаете в чем суть… скажем так, существует корабль, который нам неплохо было бы найти. Садовник, при первой нашей встрече, дал понять, что он знает местонахождение этого корабля. Но выдавать эту информацию он отказался. Сказал, что это не наш путь, и найти корабль мы должны сами.;53;;;
53;Хм…. Капитан, это невозможно объяснить. Садовники следуют философии Пути. Мы тоже, вольно или невольно пользуемся ей. Да, можно сказать, что Кодекс Обмена частично связан с философией Пути…. Но только частично.;;;;
;Хорошо. Что такое философия Пути? В чем суть?;54;;;klisk.knows_about_path_philosophy
;Кодекс… расскажите мне толком, что это такое, и как это связано с философией Пути?;57;;;klisk.knows_about_path_philosophy
;А как тут замешаны Садовники? Кто они вообще такие? Боги? Нечто близкое?;58;;;
;Черт. Как это… запутанно и мудрено. И хотя смысл безусловно имеет, но вернемся лучше к делам. Вы пытались мне солгать.;50;;;
54;Философия Пути – все течет, все меняется. Вещи заслуживают своей цены, ибо без нее – вещь становится бесполезна. Это невозможно описать вам, капитан людей. Вы сами должны понять свою философию Пути.;;;;
;Пожалуй… да. Мне трудно понять, что вы хотели сказать, но нечто подобное существовало и у нас на Земле. Пожалуй, на досуге я воспользуюсь электронной энциклопедией. А пока, вернемся к делам. Почему вы пытались нас обмануть?;50;;;
;Кодекс… расскажите мне толком, что это такое, и как это связано с философией Пути?;57;;;
;А как тут замешаны Садовники? Кто они вообще такие? Боги? Нечто близкое?;58;;;
57;Наш Кодекс ведет Клисков издревле. Сначала в нем говорилось, что хорошо, а что плохо. Чему следовать – а чему нет. Сейчас, он изменен, и в нем сказано, что достойно обмена – а что недостойно. Есть вещи столь ценные, что их названия указаны без изменений с точной формулировкой обмена.;;;;
;Хм…. Откуда вы знаете какие вещи и на что менять? Как ваш Кодекс связан с философией Пути Садовников? Как появился Кодекс?;59;;;
59;Кодекс вел Клисков издавна. Начиная от рассвета моего народа, кончая его сегодняшним положением. Информация в нем была актуальна времени и месту. Связь Кодекса с философией Садовников, очень проста – как философия говорит, что из противоположностей возникает все в жизни, и познается через них, так и Кодекс утверждает, что истинная ценность становится понятна лишь после сделки. До сделки – предмет бесплотен и абсолютно бесполезен. Лишь полученное за соответствующую плату – ценно. К тому же, добывая плату, ты совершаешь множество иных сделок, укрепляя себя во многих аспектах.;;;;
;То есть, только оплаченная информация обретает цену? Как это понять?;60;;;
60;Думайте, пожалуй, сами, капитан.;;;;
;Сами так сами. Ладно. Думаю, хватит заумных бесед, нас ждут дела… вы пытались нас обмануть, клиск.;50;;;
;А как тут замешаны Садовники? Кто они вообще такие? Боги? Нечто близкое?;58;;;
58;О, нет, Садовников нельзя назвать Богами. Их ведет собственный Путь, они просто продвинулись дальше. Это все, что я могу сказать вам на данный момент.;;;;
;Почему не больше?;61;;;
61;Больше – точка зрения клисков. Вы должны составить свою, прежде чем знать иные.;;;;
;Грубовато, как мне кажется, но логику улавливаю. Думаю, этот разговор повторится, когда я более-менее разберусь во всей этой, простите, мутной теме. А пока – почему вы пытались нам соврать?;50;;;
;А можно подробнее про кодекс? Что это такое? Что за философия пути?;57;;;
51;Вы действительно не понимаете? Или не пытаетесь понять? Капитан…. Капитан! Почему вы считаете себя достойным требовать больше, чем вам предлагают?;;;;
;Потому что иначе – мой народ ответит вам враждой и яростью. И поверьте, несмотря на то, что мы может быть и не настолько развиты как вы, но нашей ярости вам лучше не знать.;62;;;
;Потому что в данной ситуации – я не считаю это наглостью. Я представляю тех, кто объективно в более худшем положении, нежели вы. Отказ помочь, выглядит либо глупостью, либо подлостью.;63;;;
62;О…. Простите. Вы грозите… вы грозите Клискам войной?;;;;
;Вы правильно меня поняли.;64;;;
;Нет-нет, что вы! Это была… глупая шутка. Да. Глупая шутка.;65;;;
64;*щелчки. Клиск поворачивается к вам спиной, и буквально выныривает за границы экрана – очевидно, работая с каким-то подобием компьютера. Ждать приходится долго, через несколько минут он появляется назад* Вы отказались следовать Кодексу, капитан. В то же время, подарок Клисков был вами отвергнут, и мы не понимаем почему.  Однако, война – это плохо. Это глупо. В нашем случае это нерационально и вредит торговле. Поэтому, наша реакция следующая. Координаты столичных планет уже пересланы вам, капитан, ведь мы надеемся на ваше вразумление. Но страх войны, заставляет нас прекратить торговую поддержку вашего народа, именно по военной части. Любые боеприпасы, улучшения вооружения, и само оружие, теперь недоступно вам, поскольку мы – боимся.;;;;
;Погодите, но это же глупо!;66;;;
66;Ни в коем разе. Вы по-прежнему можете покупать у нас все, что угодно. Но давать вам возможность продуктивной атаки, мы не хотим.;;;;
;Послушайте, постойте! *клиск обрывает приватную связь, ты смотришь в пустой экран*;-1;;;
65;Глупая шутка…. Если судить по одному представителю, то ваш народ – глупый, вспыльчивый, и неожиданно трусливый. Если уж вы хотите запугать клисков, то почему не попытались пойти до конца? Мы не приемлем таких шуток. Помощи от нас вы не дождетесь.;;;;
;Послушайте, но это же действительно была….;67;;;
67;Глупая шутка? А вы действительно считаете, что такие шутки можно позволять себе в таком важном разговоре? Удачи вам, капитан. А если быть более точным, то скорее ума. Иначе, с такими повадками, жить вам – до первой встречи с Борками. ;;;;
;Да послушайте же!;-1;;;
63;В чем наша глупость? В чем наша подлость?;;;;
;Вы отказываетесь помочь моему народу. Глупость в том, что поделиться информацией о ваших соседях, ничуть не хуже того, чтобы просто дать координаты столичных планет. Нам не нужны секретные данные, в конце-то концов! Подлость в том, что ваш слишком настойчивый отказ, выглядит попыткой заставить нас совершить  ошибочные, вредные действия.;68;;;
68;Так значит вот, как вы мыслите …. *щелканье. Клиск будто бы смеется* Почему?;;;;
;В каком смысле, почему?;69;;;
69;Почему вы так подозрительны? Я могу понять это, но понять скорее с позиции теоретической, чем с позиции практика. Вы пережили много войн? С кем? Разве вашу планету пытались покорить?;;;;
;Мне странно слышать ваше удивление, ведь наверняка и ваш народ воевал между собой, хотя бы до того, как вышел в космос. Но, да, вы правы - Земля – очень нестабильная планета. Войн, затронувших весь мир, было немало. В то же время и более мелкие конфликты не прекращаются до сих пор. И поверьте, если вы не измените точку зрения, то их будет еще больше.;70;;;
;Покорить – не пытались. Но мы, люди… не знаю, как это сказать Или мы воинственные? Или разные? Всегда находились поводы воевать, убивать. Знаете, много я мог бы попытаться рассказать об этом, но хватит и двух фраз…. Первая: война – это кровь, ужас, смерть.;71;;;
;Любая информация стоит денег, и это не мои слова.;72;;;
72;Платой за вашу информацию служит информация о любой из рас. Вы видите, что это логично, вы сами пришли к такому вердикту. Так чем же вы не довольны? ;;;;
;Ох. И действительно. Напомните условия?;24;;;
70;Мы… не знаю, покажется ли вам это странным, но мы хотим подробностей. Можно?;;;;
;Пожалуйста. Я попрошу предоставить вам некоторые данные. *связаться с Гордоном, приказать подготовить пакет информации о военной истории Земли*;73;;;
73;*клиск изучает информацию достаточно быстро. Минуты три, даже не прерывая сеанс связи. Щелканье, выражающее его эмоции, то стихает, то гремит подобно барабанному бою. Он явно под впечатлением* О! О… Как это… вы! Какие вы… странные!;;;;
;Простите?;74;;;
74;Вы ужасные. Вы прекрасные. Столько смерти, столько героизма… ради чего? Ради… ради таких вещей…. Вы как Борки, но вы не Борки…. И такой ужас у вас… на планете такой ужас! Они умирают, все умирают! *щелканье не смолкает, клиск говорит быстро, очень, буквально тараторит*;;;;
;Теперь вы меня понимаете?;75;;;
75;Да! Да-да-да!! Конечно! *щелканье внезапно замолкает* Но, Кодекс…. Я должен посоветоваться!;;;;
;Видимо, мне придется ожидать.;76;;;
76;*Прошло некоторое время. Экран видеосвязи загорается . Клиск появляется неожиданно, отрывая тебя от небольшого перекуса.* Совет с моими коллегами прошел, капитан Людей.;;;;
;И каков ваш вердикт?;77;;;
77;Кодекс запрещает передачу информации просто так. Мы не можем оставить вас, вашу планету. Поэтому… мы все еще предлагаем обмен. Все еще информации о вас, на информацию о любом другом народе. Но, чтобы помочь вам, я сам расскажу вам о моей расе, о клисках.  Большего – нельзя. Кодекс.;;;;
;Я вынужден признать, что это разумно. Да, конечно, это разумно.;78;;;
;Хм… и все бы хорошо, но я пока предпочту погодить. А какие начальные условия?;24;;;
78;В таком случае, капитан, я даю вашему кораблю добро на стыковку. Добро пожаловать на станцию клисков.;;;;
;Благодарю. Начинаю стыковку. Конец связи.;-3;;3;
71;А вторая фраза?;;;;
;Война никогда не меняется. И я знаю, как вам это получше показать. Точнее, кто лучше всего покажет. *связаться с Генри, приказать ему включиться в приватный каналсвязи с клиском*;79;;;
79;*Проходит некоторое время. Клиск выглядит пораженным, насколько вообще это представляется возможным понять, из мимики чужого существа* Это… это невероятно. Такая холодность, но такая….;;;;
;Вы о моем офицере? Или о военной истории земли?;80;;;
80;О военной истории, конечно же. Это… такое количество войн. Такие одинаковые, и такие разные люди….;;;;
;Вряд ли все станет еще лучше, если вы будете продолжать упорствовать на вашем глупом условии.;81;;;
81;Мы будем продолжать упорствовать, и оно вовсе не глупое! Просто вы нас не понимаете, зато мы стали понимать вас чуть лучше. И выход видим в следующем…. Вам будут предоставлены все те же координаты столичных планет, и получить любую информацию о народах живущих на них, вы можете на уже озвученных ранее условиях. Однако, мы прониклись ситуацией на Земле. Вам необходима помощь. Именно поэтому, координаты ближайшей к вам, превосходной для колонизации планеты, уже готовы к передаче. Конечно, местная фауна будет против… но для такой воинственной расы как вы, это не должно быть существенной проблемой.;;;;
;Я приятно удивлен тем, что вы прониклись горем моей планеты. Это не идеал, но лучше чем ничего.;82;;;
82;В таком случае, стыкуйтесь. Добро на это уже дано.;;;;
;Принято. Начинаю стыковку. Конец связи.;-4;;4;
