0;*на экране видеосвязи появляется неизвестное тебе существо. Нельзя понять какие эмоции оно испытывает, но агрессивным его явно назвать нельзя* Вы… Кто?;;;;
;Мы приписаны к планете Земля,и представляем расу людей. Это наш первый контакт с вами.;1;;;
1;Хорошо…. *существо издает непонятные щелчки* Клиски. Это мы.;;;;
;Нам очень приятно и радостно видеть наших братьев по разуму.  Вы – вторые, кого мы увидели. Первыми нас повстречали Садовники.;2;;;
2;*Клиска передергивает. По крайней мере, это выглядит так.* Тц-тц-тц-тц! *Клиск издает животные щелчки*Они продали вам информацию? Продали? Какую?;;;;
;Нет, мы не заключали сделок. Между нами произошел очень странный разговор…. Садовники посоветовали нам прежде всего связаться с вами. Они сказали, что это облегчит связь  с другими инопланетянами.;3;;;
3;Странно. Садовники заключили с нами сделку… и не заключили ее с вами.;;;;
;Этостранно?;4;;;
4;Это неважно. *снова щелчки* Они были правы. Если вы хотите связаться с другими расами, вы обращаетесь к клискам. Клиски – лучшие торговцы во всем Средоточии. ;;;;
;Клиски…. Расскажите мне о вашем народе?;5;;;
;Чем вы торгуете?;6;;;
;И все же, о сделке. Почему это неважно? Что за сделку они с вами заключили?;7;;;
;Да. Мы хотим узнать о других инопланетянах, и связаться с ними. Не знаю. Наладить контакты, заключить договора о взаимном сотрудничестве….;8;;;
5;Клиски. Вам ничего не даст перевод этого слова, поверьте. Мой народ испокон времен живет торговлей, нас ведет Торговый Кодекс.;;;;
;Торговый Кодекс?;9;;;
9;Да. В нем мы находим знания о правильной ценности сущего, и о благоприятном взаимообмене. Клиск подчинен Торговому Кодексу, и это ведет Клиска к процветанию.;;;;
;Погодите-погоди. То есть, Торговый Кодекс… эм-м… это ваша религия?;10;;;
10;Нет! *Клиск снова щелкает, однако теперь щелчки более частые* Клиски отошли от таких понятий. Торговый Кодекс – это другое. Сказал же, в нем лежит знание о ценности сущего и о благоприятном обмене.;;;;
;Не религия, так философия жизни. Но все равно, мне это кажется несколько странным.;11;;;
11;Вы не клиск. Вам не понять.;;;;
;Наверное, оно действительно так.;4;;;
6;Всем, что нам выгодно.;;;;
;Эм…. Полезные ископаемые? Планеты? Всем – это растяжимое понятие.;12;;;
12;*щелчки, медленные и тягучие. Похоже на смех.* Нет, мы торгуем всем, но не торгуем распространенными вещами. Может для вашего народа это будет открытием, но Скопление – бесконечно. И с каждой секундой, оно становится все больше и больше. На каждого хватит планет и ресурсов. Глупо было бы ими торговать.;;;;
;Теория большого взрыва популярна и тут, значит. Хорошо. Тогда чем, все же?;13;;;
13;Самая ценная вещь – в чужой голове. Это информация. Скопление бесконечно, и точно так же оно неизведанно. И Клиски, и Борки, и Зорсаны, и даже Бродяги хотят знать о том, что их окружает. Чем информация подробнее, тем она дороже. За карту новой системы вы получите мало. За полное сканирование всех планет, с примерами генетических, геологических, и иных образцов, соответственно, много.;;;;
;Хорошо…. И что, торговля ведется только информацией? Ничем иным вы не торгуете? Не знаю… ремонтные детали? Медикаменты?;14;;;
;Борки? Зорсаны? Бродяги?;15;;;
14;*щелчки. Опять похоже на смех* Вы смешной. Это же очевидно, что да. Я думал, мы вели речь о масштабной торговле.;;;;
;Да-да, конечно, извините. Итак, информация. И?;16;;;
16;И разные…. Необычные вещи. Они не похожи друг на друга. Иногда – это следы цивилизаций, которых уже нет. Иногда, это необычный, ценный образец ресурсов…. Мы не знаем. Кто ищет, тот всегда найдет. ;;;;
;Хорошо. А кто такие Борки? Зорсаны? Бродяги?;15;;;
15;Всякая информация стоит кредитов…. Впрочем, основы я буду способен поведать просто так. Вы говорите о расе второго типа. Борки. Они агрессивны и тупы, но не все. Если кто-то нападет на вас без объявления своих намерений, нападет ради нападения, то скорее всего это какой-то борк.;;;;
;Ох. А Зорсаны, или Бродяги?;17;;;
17;Бродяги. Они бродяги. Когда-то у них была своя планета, но они ее покинули. Не знаю почему, это было очень далеко и очень давно. Теперь, их родина – конгломерат огромных мазершипов. Раньше, Бродяги поставляли нам ценную информацию, они вольные жители космоса, и исследовали его далеко. Однако…. В последнее время *он говорит некое слово, которое твое переводчик интерпретирует как «пятьдесят лет»* они поумерили свою активность. Это печально для нас….;;;;
;Хм. Интересно. Как необычно…. А что насчет Зорсанов? Или Зорсан?;18;;;
18;Все равно. Зорсаны молоды. Они считают себя империей, и их повадки агрессивны. Не так, как у Борков, но я надеюсь, что вы нас поняли. Они еще не поняли, что в Скоплении полно места для всех и каждого…. Поймут. Когда-нибудь.;;;;
;Вы что-то говорили о каких-то типах рас. Якобы, я спрашивал только о втором. Что вы имели в виду?;19;;;
;О какой сделке с Садовниками вы вели речь? Это странные существа. Я просто хочу научиться лучше их понимать.;7;;;
;Я вас понял. Вот как раз об этом, я бы и хотел с вами поговорить. Понимаете, мой народ относительно недавно освоил технологию перемещения по дальнему космосу. Мне даны инструкции, согласно которым, я обязан наладить дипломатический контакт со встреченными мне развитыми расами.;8;;;
19;Типов рас всего пять. Деление происходит по множеству факторов. Начиная от биологической, и кончая поведением представителей. Это неважно. Важно лишь то, что разные типы, они действительно разные. Раса второго типа, не может контактировать с расой третьего типа – как по физическим показателям, так и по банальной логике поведения. Клиски могут устанавливать такой контакт. И это стоит дорого. Очень. Очень-очень.;;;;
;О какой сделке с Садовниками вы вели речь? Это странные существа. Я просто хочу научиться лучше их понимать.;7;;;
;Хорошо. Пока что этот аспект вашей деятельности меня не интересует. Я хотел бы связаться с другими народами. Дипломатически, конечно.;8;;;
7;*щелчки быстрые, без ярко выраженного ритма. Исходя из того, что ты видишь, ты понимаешь, что это озабоченность*;;;;
;Что-то не так? Это конфиденциальная информация?;20;;;
20;Нет. Просто мы кое-что поняли о Садовниках;;;;
;Что?;21;;;
21;Информация стоит кредитов…. Кодекс запрещает делиться этим просто так. Кроме того, тем, что мы узнали только что, пока запрещено делиться.;;;;
;Кодекс? Какой кодекс?;22;;;
;Я вас понял. В таком случае, у меня другой вопрос, как раз по вашей специальности. Мне дан приказ, наладить отношения со всеми встреченными мне развитыми инопланетянами. Дипломатические. Мне кажется, что ваша помощь была бы мне очень кстати.;8;;;
22;Он ведет нас.;;;;
;Ведет вас? В смысле, законы или устои?;9;;;
8;*быстрые щелчки, с очень четким ритмом* Тц-тц-тц-тц. Сделка. Сделка. Это хорошо.;;;;
;….;23;;;
23;Кодекс гласит о сделке, но сделки может и не быть…. Если вам нужны координаты столичных планет – вы можете получить их просто так. Жест доброй воли. *щелчки, торопливые, постепенно замедляющиеся* Однако, могу предоставить информацию, которая поможет вам  наладить дипломатические отношения с весьма немалым шансом большой выгоды для себя. Это – сделка. Сделка не бывает просто так.;;;;
;Так. Я боюсь спросить, конечно, но какова цена?;24;;;
24;Вы можете заплатить кредитами. Семь кредитов за информацию об одной из рас, включая Клиск, на выбор. Всего, двадцать восемь. И, кажется, будто у вас таких денег нет. Если это правдиво, то вы можете совершить обмен – сведения о вас, на сведения об одной из рас. Нам это кажется равноценным. Если же наши данные ошибочны – то мы только рады наличному расчету.;;;;
;Слушайте, мне кажется, вы ведете себя бесчестно. ;25;;;
;Хм. Информацией на информацию…. Что конкретно вы хотите знать о моем народе?;26;;;
;Я не думаю, что имею право, так вот сразу вступать в столь близкий контакт. Мне кажется, что простых координат будет достаточно.;27;;;
;Хм. Значит, можно обменять информацию о себе, на информацию о ком либо? А если я не хочу менять? Могу ли я просто продать вам нужные данные?;28;;;
;Ваше предложение очень нам льстит, но, к сожалению, оно нам бесполезно. Нужные координаты у нас уже есть.;29;colony_search.found;;
;Ваши данные ошибочны – некоторая наличность у меня есть.;30;credits>0;;
;Знаете, я хочу собрать офицерский совет. Мне необходимо провести совещание по данному вопросу. Надеюсь, что вы поймете, и не сочтете это бестактностью.;31;;;
31;Не стоит беспокоиться. Это разумное решение, характеризующее вас с самой лучшей стороны. Данная линия связи будет свободна, как только закончите совещание – связывайтесь немедля.;;;;
;Благодарю вас. Конец связи.;-1;;10;
29;О…. Трудно было предположить, что мы встретимся уже с подготовленным существом. Это лишь красит вас, капитан людей. В таком случае, если хотите, вы можете получить небольшую скидку для первой покупки. Любой товар, минус десять процентов. Считайте это той самой данью уважения. ;;;;
;Скидка - это всегда хорошо. Так что у нас там с платой?;24;;;klisk.discount
30;Значит тем лучше. Но если вы захотите приберечь свои деньги, или потратить их на иной товар, мы будем рады совершить все тот же обмен информацией. Ведь Кодекс гласит, что деньги – сильнейший уравнитель и лучшая плата, но порой лучше менять подобное на подобное, поскольку это влечет за собой большую выгоду в дальнейшем.;;;;
;А если я не могу подобным на подобное?;24;;;
28;Значит вы предпочитаете твердую валюту? Пожалуй, это можно назвать разумным. Конечно, вы можете не обменивать свои данные, взяв за них определенную сумму кредитами.;;;;
;Сколько вы дадите за общую информацию о моем народе? А за подробную?;32;;;
32;Обычная цена за общее досье – семь кредитов. Далее – все зависит лишь от степени подробности.;;;;
;Хм…. Повторите, что вы требуете за информацию о расах?  ;24;;;
27;Конечно, это ваш выбор. Однако, поверьте, вы очень многое упускаете….;;;;
;Вы так считаете?;33;;;
;И все же, я предпочту пока не ввязываться в авантюры. На мне лежит большая ответственность, поэтому я ограничусь лишь координатами.;34;;;
34;В таком случае – конец связи. Стыкуйтесь со спец.доком, капитан. Буду рад приветствовать вас на этой станции.;;;;
;Конец связи.;-1;;;
33;Я уверен, что вам есть, что предложить – а у меня найдется, чем за это заплатить. Кодекс гласит, что имея возможность сделки – надо совершать сделку, поскольку это влечет за собой взаимную выгоду и крепкую дружбу.;;;;
;Хорошо. Вернемся к обсуждению условий. Что вы там хотели взамен за информацию о расах? ;24;;;
;И все же, я вынужден отказаться.;35;;;
35;Жаль, очень жаль. Но это ваше дело. В любом случае – стыкуйтесь, все остальное обсудим уже там.;;;;
;Конец связи.;-1;;;
26;Все зависит от того, что вы захотите предоставить. Можете ограничиться начальными данными, касающимися лишь самых базовых знаний о вас и вашем народе. Этого все равно хватит на обмен.;;;;
;Именно так я и хочу поступить.;36;;;
;А что я получу, если данные будут более подробны?;37;;;
;Я думаю, что мой вопрос вполне закономерен: зачем вам информация о моем народе? ;38;;;
;Знаете… я предпочту пока что отказаться.;39;;;
;Я думаю, что лучше вам будет озвучить все условия заново. ;24;;;
36;Я рад, что мы пришли к согласию. Стыкуйтесь, капитан, док для вашего корабля уже готов.;;;;
;Отлично. Конец связи.;-1;;;
39;Жаль, но что поделаешь? В любом случае, если передумаете, я буду рад объясниться снова. А пока – стыкуйтесь, я уже отдал приказ о подготовке. Добро пожаловать.;;;;
;Жаль, но что поделать? Конец связи.;-1;;;
38;Все достаточно просто. Первое – собираясь налаживать отношения с иными расами, вам нельзя оставаться…. *медленные щелчки* темными. Скрытными. Второе – зная кто вы, и чем дышите, клиски смогут более выгодно торговать с вами, а иные народы более хорошо поймут вас. Впрочем, если вы чего-то сомневаетесь или боитесь – никто из вас насильно сведения тянуть не будет…. ;;;;
;Понятно. Так что конкретно вы хотите знать? ;26;;;
37;Все зависит от качества и количества…. За полный биологический отчет, плюс хорошую историческую справку, вы получите неплохой бонус. Трудно так сразу сказать какой, вы же понимаете.;;;;
;Меня все устраивает, пожалуй.;40;;;
;При всем уважении, меня терзает вопрос: зачем вам столь подробные сведения о моей расе?;41;;;
;Больше подробностей. Полный биологический отчет и хорошая историческая справка – это растяжимые понятия.;42;;;
;Знаете, вернемся к обсуждению способов оплаты. ;24;;;
;А если я хочу поделиться лишь небольшим количеством сведений? ;26;;;
40;В таком случае, я прикажу открыть стыковочный док. Добро пожаловать на торговую станцию, капитан людей.;;;;
;Благодарю за гостеприимство. Конец связи.;-1;;;
41;Не стесняйтесь, это понятный вопрос. Получив данные о вас – мы сможем более точно представлять, какого рода нашими услугами будет пользоваться ваш народ. Кроме того, существует общепознавательный и научный интерес. Я думаю, вы понимаете, что из биологических и исторических данных трудно будет выжать что-то такое, что поможет нанести вам особый вред, урон.;;;;
;Так то оно безусловно так, но все равно…. Моему народу вот только проблем еще и в космосе не хватает, помимо тех, что уже есть.;43;;;
;О. В таком случае… пожалуй…. Что я получу, за избыток информации со своей стороны?  ;36;;;
43;Проблем в космосе? *щелчки заинтересованности* Расскажите подробнее, если это не столь секретно.;;;;
;Вкратце говоря, скажем так, мой корабль – не пионер моего народа в деле исследования. Был еще один, который пропал. Более сказать не могу… вы же понимаете.;44;;;
;Трудно объяснить. Моя планета сейчас переживает не лучшие времена – энергетический кризис поджимает. Помимо всего прочего, первый научно-исследовательский корабль отправленный в космос, через некоторое время пропал, что очень сильно ударило по нам. Мой корабль, как вы понимаете, второй. Именно поэтому, я не могу позволить себе, что называется, ударить в грязь лицом.;45;;;
;Вы правильно выразились – столь секретно. Я не вправе разглашать подобную информацию, искренне надеюсь, что вы меня поймете.;46;;;
46;О. *медленные щелчки* Безусловно, никакой обиды быть не может. Вы хотели обсудить объемы предоставляемой информации.;;;;
;Точно. Так что насчет информации?;37;;;
45;О…. Сожалею и сочувствую вашему горю. *щелчки резко взвинчивают, но тут же замедляют свой темп, видимо, клиск доволен* Вернемся к обсуждению дел. Мы говорили о вознаграждении за разное количество информации…. ;;;;
;Да, конечно. Повторите ваши условия.;37;;;
44;Это интересно. Вы можете рассказать подробнее? Предупреждая вопрос – любая информация пригодится клискам.;;;;
;Простите, нет. Как я уже говорил, это секретно. К тому же, я хочу снова услышать ваши предложения, касательно моих данных.;37;;;
