Имя;Картинка;Текст
Лидер Европейского Объединения;europe_leader;Они не вернутся. Мы поднимали эту тему ещё месяц назад… теперь мы знаем наверняка.
Лидер Азиатского Союза;asia_leader;"
Финансы, вложенные в проект, всё ещё не отбиты. Убытки одного только Союза составляют почти сто миллиардов! Да, были интересные образцы и данные. Но вы видели отчёты. Подобные вливания привели к масштабному дефициту. Индекс довольства населения упал! Такого не было уже пятьдесят лет, со времен событий в Африке!"
Лидер Европейского Объединения;europe_leader;"И всё-таки... вы изучили предоставленный вам ранее план проекта ""Аврора-2""? Отказ от космической программы только ухудшит ситуацию, выбора у нас нет. Мы не можем себе позволить аннексию незавимых государств. Эскалация агрессивной политике неприемлема. ""Аврора-1"" продемонстрировала огромный потенциал космических исследований, пусть даже и исчезла. В космосе есть всё, что нам нужно. Мы должны лишь протянуть руку и взять."
Лидер Американского Альянса;usa_leader;"Ещё один такой же корабль? Вы получили мой отчёт о состоянии бюджета Альянса? Дефицит слишком сильный. Оппозиция уже в открытую заявляет о том, что ""Аврора"" - это напрасная трата денег. И в народе всё больше тех, кто их поддерживает. В отдельных регионах у нас перебои с энергоснабжением и даже с поставками продовольствия!"
Лидер Европейского Объединения;europe_leader;"
Раньше мы не смогли бы. Но сейчас, с более продвинутой технической базой и развитыми технологиями... Конечно, новый корабль не будет таким, как оригинальная ""Аврора"". Мы сможем уменьшить траты. Но функционал останется таким же, и даже больше."
Лидер Азиатского Союза;asia_leader;Затраты всё равно будут огромными. Даже с учётом уменьшенных трат. Вот если бы кто-то один взял на себя большую часть трат! Это было бы невероятным облегчением для остальных союзов-участников.
Лидер Европейского Объединения;europe_leader;И это правильно. Согласно моим отчётам, одно из объединений обладает достаточным количеством допустимо изымаемых средств, чтобы взять на себя основные затраты проекта - пятьдесят процентов. Конечно, это много, но, вы должны понимать, что большая часть доходов, которые непременно будут, пойдёт именно этому объединению. Я думаю, вы уже понимаете, о ком идёт речь. Это...
